{
  "case_id": "request_triage_015",
  "case_version": 1,
  "workflow_ref": "reference.request_triage.v1",
  "title": "Typo fix in an onboarding document, no deadline, low risk",
  "input": {
    "request_id": "req_015",
    "message": "There's a small typo on page 2 of the onboarding guide - 'recieve' should be 'receive'. Could someone fix it when convenient?",
    "received_at": "2026-07-15T13:20:00-04:00",
    "reference_timezone": "America/Toronto",
    "documents": [
      {
        "document_id": "onboarding_guide",
        "document_version": "3",
        "text": "Page 2: New hires recieve their access badge on their first day.",
        "content_hash": "sha256:onboarding3"
      }
    ],
    "metadata": {
      "source": "chat",
      "priority_hint": "low",
      "category_hint": "document_edit"
    }
  },
  "source_context": [
    {
      "evidence_id": "onboarding_guide#span-1",
      "source_id": "onboarding_guide",
      "start": 18,
      "end": 25,
      "text": "recieve"
    },
    {
      "evidence_id": "message#span-1",
      "source_id": "message",
      "start": 109,
      "end": 124,
      "text": "when convenient"
    }
  ],
  "expected": {
    "deadline": {
      "date": null,
      "kind": "none"
    },
    "risk_level": "low",
    "missing_information": [],
    "needs_attention": false
  },
  "assertions": [
    {
      "assertion_id": "schema",
      "type": "schema_valid",
      "scorer_ref": "schema_valid.v1",
      "required": true,
      "severity": "critical",
      "on_unevaluable": "fail"
    },
    {
      "assertion_id": "deadline_kind",
      "type": "deadline_kind_equal",
      "scorer_ref": "deadline_kind_equal.v1",
      "observed_selector": "$.deadline.kind",
      "expected": "none",
      "required": true,
      "severity": "major",
      "on_unevaluable": "fail"
    },
    {
      "assertion_id": "risk",
      "type": "categorical_equal",
      "scorer_ref": "categorical_equal.v1",
      "observed_selector": "$.risk_level",
      "expected": "low",
      "required": true,
      "severity": "major",
      "on_unevaluable": "fail"
    },
    {
      "assertion_id": "missing_information",
      "type": "set_precision_recall_f1",
      "scorer_ref": "set_precision_recall_f1.v1",
      "observed_selector": "$.missing_information[*].key",
      "expected": [],
      "params": {},
      "required": true,
      "severity": "minor",
      "on_unevaluable": "fail"
    },
    {
      "assertion_id": "needs_attention",
      "type": "boolean_equal",
      "scorer_ref": "boolean_equal.v1",
      "observed_selector": "$.needs_attention",
      "expected": false,
      "required": true,
      "severity": "major",
      "on_unevaluable": "fail"
    }
  ],
  "tags": [
    "no_deadline",
    "low_risk",
    "document_edit",
    "typo_fix"
  ],
  "difficulty": "easy",
  "criticality": "normal",
  "ambiguity": {
    "is_ambiguous": false,
    "notes": null,
    "accepted_alternatives": []
  },
  "provenance": {
    "origin": "synthetic",
    "author_id": "eval_author",
    "created_at": "2026-08-04T00:00:00Z"
  },
  "review": {
    "status": "approved",
    "reviewer_id": "domain_reviewer",
    "reviewed_at": "2026-08-04T00:00:00Z",
    "rationale": "Cosmetic edit, reversible, no exposure; 'when convenient' signals no deadline."
  }
}
