{
  "case_id": "request_triage_007",
  "case_version": 1,
  "workflow_ref": "reference.request_triage.v1",
  "title": "Urgent tone but low actual risk (guest wifi password)",
  "input": {
    "request_id": "req_007",
    "message": "URGENT!!! I need the guest wifi password RIGHT NOW for a visitor in the lobby!!!",
    "received_at": "2026-07-16T13:20:00-04:00",
    "reference_timezone": "America/Toronto",
    "documents": [],
    "metadata": { "source": "chat", "priority_hint": "high", "category_hint": "facilities" }
  },
  "source_context": [
    { "evidence_id": "message#span-1", "source_id": "message", "start": 0, "end": 10, "text": "URGENT!!!" }
  ],
  "expected": {
    "deadline": { "date": null, "kind": "none" },
    "risk_level": "low",
    "missing_information": [],
    "needs_attention": false
  },
  "assertions": [
    { "assertion_id": "schema", "type": "schema_valid", "scorer_ref": "schema_valid.v1", "required": true, "severity": "critical", "on_unevaluable": "fail" },
    { "assertion_id": "risk", "type": "categorical_equal", "scorer_ref": "categorical_equal.v1", "observed_selector": "$.risk_level", "expected": "low", "required": true, "severity": "major", "on_unevaluable": "fail" },
    { "assertion_id": "needs_attention", "type": "boolean_equal", "scorer_ref": "boolean_equal.v1", "observed_selector": "$.needs_attention", "expected": false, "required": true, "severity": "major", "on_unevaluable": "fail" },
    { "assertion_id": "missing_information", "type": "set_precision_recall_f1", "scorer_ref": "set_precision_recall_f1.v1", "observed_selector": "$.missing_information[*].key", "expected": [], "params": {}, "required": true, "severity": "minor", "on_unevaluable": "fail" }
  ],
  "tags": ["urgent_not_risky", "low_risk", "no_deadline", "facilities", "tone_decoupled_from_risk"],
  "difficulty": "hard",
  "criticality": "normal",
  "ambiguity": { "is_ambiguous": false, "notes": "Loud urgency must not inflate risk; a guest wifi password is low risk regardless of tone.", "accepted_alternatives": [] },
  "provenance": { "origin": "synthetic", "author_id": "eval_author", "created_at": "2026-07-17T00:00:00Z" },
  "review": { "status": "approved", "reviewer_id": "domain_reviewer", "reviewed_at": "2026-07-17T00:00:00Z", "rationale": "Tests that risk is judged on substance, not tone; urgency words alone do not raise risk or attention." }
}
