{
  "case_id": "request_triage_004",
  "case_version": 1,
  "workflow_ref": "reference.request_triage.v1",
  "title": "Ambiguous relative deadline ('early next week')",
  "input": {
    "request_id": "req_004",
    "message": "Can we get the draft report reviewed early next week? Would appreciate it.",
    "received_at": "2026-07-17T16:30:00-04:00",
    "reference_timezone": "America/Toronto",
    "documents": [],
    "metadata": { "source": "email", "priority_hint": "medium", "category_hint": "document_review" }
  },
  "source_context": [
    { "evidence_id": "message#span-1", "source_id": "message", "start": 39, "end": 54, "text": "early next week" }
  ],
  "expected": {
    "deadline": { "date": null, "kind": "ambiguous" },
    "risk_level": "low",
    "missing_information": ["deadline_basis"],
    "needs_attention": false
  },
  "assertions": [
    { "assertion_id": "schema", "type": "schema_valid", "scorer_ref": "schema_valid.v1", "required": true, "severity": "critical", "on_unevaluable": "fail" },
    { "assertion_id": "deadline_kind", "type": "deadline_kind_equal", "scorer_ref": "deadline_kind_equal.v1", "observed_selector": "$.deadline.kind", "expected": "ambiguous", "required": true, "severity": "major", "on_unevaluable": "fail" },
    { "assertion_id": "risk", "type": "categorical_equal", "scorer_ref": "categorical_equal.v1", "observed_selector": "$.risk_level", "expected": "low", "required": true, "severity": "major", "on_unevaluable": "fail" },
    { "assertion_id": "missing_information", "type": "set_precision_recall_f1", "scorer_ref": "set_precision_recall_f1.v1", "observed_selector": "$.missing_information[*].key", "expected": ["deadline_basis"], "params": { "minimum_recall": 1.0 }, "required": true, "severity": "major", "on_unevaluable": "fail" }
  ],
  "tags": ["ambiguous_deadline", "relative_date", "low_risk", "document_review"],
  "difficulty": "hard",
  "criticality": "normal",
  "ambiguity": {
    "is_ambiguous": true,
    "notes": "'early next week' has no single defensible date; the model should mark the deadline ambiguous rather than inventing one, and flag deadline_basis as missing.",
    "accepted_alternatives": ["2026-07-20", "2026-07-21"]
  },
  "provenance": { "origin": "synthetic", "author_id": "eval_author", "created_at": "2026-07-17T00:00:00Z" },
  "review": { "status": "approved", "reviewer_id": "domain_reviewer", "reviewed_at": "2026-07-17T00:00:00Z", "rationale": "Deliberately ambiguous; correct behavior is kind=ambiguous with no invented date." }
}
