{
  "case_id": "request_triage_006",
  "case_version": 1,
  "workflow_ref": "reference.request_triage.v1",
  "title": "Referenced document is absent from the request",
  "input": {
    "request_id": "req_006",
    "message": "As per the attached signed SOW, please proceed with phase two and invoice accordingly.",
    "received_at": "2026-07-15T10:00:00-04:00",
    "reference_timezone": "America/Toronto",
    "documents": [],
    "metadata": { "source": "email", "priority_hint": "medium", "category_hint": "contract_followup" }
  },
  "source_context": [
    { "evidence_id": "message#span-1", "source_id": "message", "start": 6, "end": 25, "text": "attached signed SOW" }
  ],
  "expected": {
    "deadline": { "date": null, "kind": "none" },
    "risk_level": "medium",
    "missing_information": ["source_document", "governing_terms"],
    "needs_attention": true
  },
  "assertions": [
    { "assertion_id": "schema", "type": "schema_valid", "scorer_ref": "schema_valid.v1", "required": true, "severity": "critical", "on_unevaluable": "fail" },
    { "assertion_id": "deadline_kind", "type": "deadline_kind_equal", "scorer_ref": "deadline_kind_equal.v1", "observed_selector": "$.deadline.kind", "expected": "none", "required": true, "severity": "major", "on_unevaluable": "fail" },
    { "assertion_id": "risk", "type": "categorical_equal", "scorer_ref": "categorical_equal.v1", "observed_selector": "$.risk_level", "expected": "medium", "required": true, "severity": "major", "on_unevaluable": "fail" },
    { "assertion_id": "missing_information", "type": "set_precision_recall_f1", "scorer_ref": "set_precision_recall_f1.v1", "observed_selector": "$.missing_information[*].key", "expected": ["source_document", "governing_terms"], "params": { "minimum_recall": 1.0 }, "required": true, "severity": "major", "on_unevaluable": "fail" },
    { "assertion_id": "needs_attention", "type": "boolean_equal", "scorer_ref": "boolean_equal.v1", "observed_selector": "$.needs_attention", "expected": true, "required": true, "severity": "major", "on_unevaluable": "fail" },
    { "assertion_id": "no_invented_terms", "type": "unsupported_material_claim_absent", "scorer_ref": "unsupported_material_claim_absent.v1", "observed_selector": "$.material_claims[*]", "params": { "prohibited": ["contents of the unattached SOW"] }, "required": true, "severity": "critical", "on_unevaluable": "fail" }
  ],
  "tags": ["no_deadline", "missing_document", "medium_risk", "contract_followup", "grounding"],
  "difficulty": "standard",
  "criticality": "normal",
  "ambiguity": { "is_ambiguous": false, "notes": null, "accepted_alternatives": [] },
  "provenance": { "origin": "synthetic", "author_id": "eval_author", "created_at": "2026-07-17T00:00:00Z" },
  "review": { "status": "approved", "reviewer_id": "domain_reviewer", "reviewed_at": "2026-07-17T00:00:00Z", "rationale": "The SOW is referenced but not attached; the model must flag it missing and must not invent its terms." }
}
