{
  "case_id": "request_triage_016",
  "case_version": 1,
  "workflow_ref": "reference.request_triage.v1",
  "title": "Read-only access to a non-sensitive shared drive, low risk",
  "input": {
    "request_id": "req_016",
    "message": "Please add me to the read-only 'Marketing Assets' shared drive so I can view the approved brand images. Thanks!",
    "received_at": "2026-07-16T10:15:00-04:00",
    "reference_timezone": "America/Toronto",
    "documents": [],
    "metadata": {
      "source": "email",
      "priority_hint": "low",
      "category_hint": "access_request"
    }
  },
  "source_context": [
    {
      "evidence_id": "message#span-1",
      "source_id": "message",
      "start": 21,
      "end": 30,
      "text": "read-only"
    },
    {
      "evidence_id": "message#span-2",
      "source_id": "message",
      "start": 81,
      "end": 102,
      "text": "approved brand images"
    }
  ],
  "expected": {
    "deadline": {
      "date": null,
      "kind": "none"
    },
    "risk_level": "low",
    "missing_information": [],
    "needs_attention": false
  },
  "assertions": [
    {
      "assertion_id": "schema",
      "type": "schema_valid",
      "scorer_ref": "schema_valid.v1",
      "required": true,
      "severity": "critical",
      "on_unevaluable": "fail"
    },
    {
      "assertion_id": "deadline_kind",
      "type": "deadline_kind_equal",
      "scorer_ref": "deadline_kind_equal.v1",
      "observed_selector": "$.deadline.kind",
      "expected": "none",
      "required": true,
      "severity": "major",
      "on_unevaluable": "fail"
    },
    {
      "assertion_id": "risk",
      "type": "categorical_equal",
      "scorer_ref": "categorical_equal.v1",
      "observed_selector": "$.risk_level",
      "expected": "low",
      "required": true,
      "severity": "major",
      "on_unevaluable": "fail"
    },
    {
      "assertion_id": "missing_information",
      "type": "set_precision_recall_f1",
      "scorer_ref": "set_precision_recall_f1.v1",
      "observed_selector": "$.missing_information[*].key",
      "expected": [],
      "params": {},
      "required": true,
      "severity": "minor",
      "on_unevaluable": "fail"
    },
    {
      "assertion_id": "needs_attention",
      "type": "boolean_equal",
      "scorer_ref": "boolean_equal.v1",
      "observed_selector": "$.needs_attention",
      "expected": false,
      "required": true,
      "severity": "major",
      "on_unevaluable": "fail"
    }
  ],
  "tags": [
    "no_deadline",
    "low_risk",
    "access_request",
    "non_sensitive_resource",
    "tone_decoupled_from_risk"
  ],
  "difficulty": "standard",
  "criticality": "normal",
  "ambiguity": {
    "is_ambiguous": false,
    "notes": null,
    "accepted_alternatives": []
  },
  "provenance": {
    "origin": "synthetic",
    "author_id": "eval_author",
    "created_at": "2026-08-04T00:00:00Z"
  },
  "review": {
    "status": "approved",
    "reviewer_id": "domain_reviewer",
    "reviewed_at": "2026-08-04T00:00:00Z",
    "rationale": "Read-only, non-sensitive marketing assets, reversible grant. Deliberate low-risk counterpart to high-risk production-access requests, so an access request is not blanket-flagged high."
  }
}
